{
  "review": {
    "base_sha": "1111111111111111111111111111111111111111",
    "head_sha": "2222222222222222222222222222222222222222",
    "reviewer": "gate-reviewer",
    "target": "frozen-implementation"
  },
  "completion": {
    "status": "PARTIAL",
    "remaining_scope": ["registry resolution and package publication paths"],
    "continuation_notes": "Continue from packages/registry and do not repeat completed CI and test-strength checks."
  },
  "findings": [],
  "coverage": {
    "passes_completed": [4, 7],
    "commands_run": ["read prepared validation evidence", "inspect CI workflows"],
    "not_run": ["review registry resolution and publication plumbing"],
    "clean_areas": ["changed unit-test assertions", "workflow event filters"]
  }
}
